{
  "$comment": "Per-field provenance classification for api-schema.json. Cross-references the workflow stages described in workflow/README.md. 'path' uses dotted notation with [] for array items; a path ending in '.*' covers every leaf field of that sub-object identically unless overridden by a more specific entry listed separately.",
  "schema_ref": "api-schema.json",
  "workflow_ref": "workflow/README.md",
  "tiers": {
    "syntactic": "Derivable mechanically from the primary source (declared signature, type qualifier, or a flag already literally present in the source's own macro/annotation layer). Stage B. No model judgment involved.",
    "semantic": "Requires reading and interpreting descriptive prose about what the call does, or a cross-entry/cross-reference judgment. Stage C. Model-proposed, needs a confidence score.",
    "semantic_heuristic": "Semantic in principle, but a naming-convention or co-located-flag heuristic gives Stage C a strong prior to confirm rather than classify from scratch.",
    "formal": "Synthesized via shape_ref+bindings assignment or a full inline draft, then machine-validated by running it through the expander and diffing against a golden entry. Stage D, checked by Stage E.",
    "derived": "Computed mechanically from other already-classified fields in the same entry; not read from source directly.",
    "authoring_only": "Exists only in the pre-expansion authored document (shapes.json and the shape assignments). Erased by the expander. Never appears in an api-schema.json-validated instance.",
    "supplement": "Not derivable from the primary source at all (mechanically or by interpreting its prose) for this entry -- filled from curated/supplement/supplement-<ppm>.json, a hand-authored/web-researched/general-knowledge side file, gated needs_approval like every other model-touched value. For most fields, this is never a field's *primary* tier: it applies per-entry, only when the field's normally-governing stage has run and confirmed a real null, and it never overrides a stage's actual output, including a low-confidence one. See curated/README.md. **Exception, 2026-07-21:** every `tier: \"semantic\"` field below also carries `\"stage_c_mechanism\": \"supplement\"` -- these are the ~24 pure-prose Stage C fields formerly targeted by a separate model-assisted classification stage, since retired in favor of authoring these directly as supplement.json entries, the same mechanism as every other supplement-sourced field. For exactly these fields there is no other stage left to ever populate them, so an *omitted* value (not just a confirmed null) is supplement-eligible -- see workflow/supplement/propose.py's `_STAGE_C_VIA_SUPPLEMENT` handling."
  },
  "fields": [
    {
      "path": "identity.model",
      "tier": "syntactic",
      "stage": "B",
      "rationale": "Fixed by which source file is being ingested, not inferred from its content."
    },
    {
      "path": "identity.name",
      "tier": "syntactic",
      "stage": "B",
      "rationale": "Literal symbol name from the source signature."
    },
    {
      "path": "identity.api_group",
      "tier": "semantic_heuristic",
      "stage": "C",
      "rationale": "Name prefixes are a strong prior (e.g. most one-sided calls name put/get) but final classification requires reading what the call does. The 'io' value makes the whole mpi_file_* family mechanically classifiable from its name prefix -- see workflow/classify/heuristics.py."
    },
    {
      "path": "identity.since",
      "tier": "syntactic",
      "stage": "B",
      "rationale": "From version-introduced macros/changelog markers in the source, where present. This genuinely varies by PPM -- confirmed 2026-07-20 by checking, not assuming: MPI has no such marker at all (chap-changes/ contains only prose, no per-function tag); OpenSHMEM does, a real structured 'Changes to this Document' chapter (workflow/extract/shmem/changelog.py parses it, joined against every content/*.tex file Extract already processes -- a file never mentioned in an introduction-marker item is inferred to predate the changelog's own coverage, OpenSHMEM 1.0); NCCL has exactly one incidental mention in its docs mirror (the Send/Recv family, 'Since NCCL 2.7' -- not a repeatable pattern, handled via supplement.json's condensed method instead of Extract machinery); NVSHMEM has none found so far.",
      "supplement_reliance": "MPI: null for all 571 functions, Extract-side -- chap-changes/chap-semantic-changes has no per-function machine-readable marker at all; 524/571 filled via curated/supplement/supplement-mpi.json (general_knowledge, version-history pattern buckets), 47 left honestly null (genuine uncertainty, not oversight). NCCL: null for 61/63 -- only ncclSend/ncclRecv have a real source citation (condensed); the rest await either research or being left as an honest gap, project owner's call, not yet resolved as of this note. NVSHMEM: null for all 67 -- no source signal found; general recall not confident enough to fill without independent verification, not yet attempted. SHMEM: RESOLVED 2026-07-20 -- no longer relies on supplement.json at all, see the rationale above; every one of the 279 functions gets a real, mechanically-derived value directly from Extract. OpenMP (2026-09-11): null for all 96 from Extract -- omp.h's grouping comments ('/* OpenMP 5.1 */') are the implementer's notes, unevenly applied and not delimited, not per-routine markers; the three thread-team inquiries spmd maps are filled via supplement (general_knowledge). CUDA (2026-09-11): null for all 331 from Extract -- cuda_runtime_api.h has no version marker; five routines are filled via supplement (general_knowledge). See curated/README.md."
    },
    {
      "path": "identity.deprecated_in",
      "tier": "syntactic",
      "stage": "B",
      "rationale": "From deprecation macros/annotations in the source, where present."
    },
    {
      "path": "identity.standard_refs",
      "tier": "syntactic",
      "stage": "B",
      "rationale": "Section-reference macros/citations already present in the source."
    },
    {
      "path": "identity.desc",
      "tier": "syntactic",
      "stage": "B",
      "rationale": "Copied and lightly cleaned from the source's own one-line description where the source supplies one -- true for NCCL (a docs-mirror paragraph) and SHMEM (the purpose-built \\apisummary{} macro), both short and single-source. NOT true for MPI or NVSHMEM (see supplement_reliance): neither's source ships a genuine one-sentence description, so 'syntactic' does not hold uniformly across PPMs for this field, the same gap already found and left unresolved for parameters[].asynchronous/root_only/length. CUDA (added 2026-09-11) is a PPM where it does hold: cuda_runtime_api.h's doxygen \\brief line is a purpose-built one-line summary, read alone at static confidence. OpenMP (2026-09-11) holds too, but from a second vendored tier rather than the header: omp.h carries no prose at all, so Extract reads each routine's Summary sentence out of the vendored specification (external-inputs/openmp/docs/5.2/md, sliced by workflow/ingestion/openmp_spec_text.py) -- 94 of 96 routines, the other two being OpenMP 6.0 additions the vendored 5.2 does not define.",
      "supplement_reliance": "Resolved 2026-07-20 (supersedes the original per-entry framing below): MPI's prose.py first-sentence heuristic and NVSHMEM's Description-block lookup were both retired from Extract entirely, not patched -- MPI's real semantics routinely span multiple sentences (a structural mismatch, not an occasional miss) and NVSHMEM's real Description block is correct content but the wrong shape (up to ~2000 chars / 16 sentences, never one sentence). Both PPMs now emit identity.desc=null unconditionally from Extract; every one of their entries is now a legitimate curated/supplement/supplement-<ppm>.json candidate, not just the previously-null subset. NCCL and SHMEM are unaffected -- see curated/README.md. (Original finding, kept for history: MPI's mpi_comm_rank/mpi_comm_size were confirmed nulls; mpi_send/mpi_recv were a non-null-but-vacuous edge case the precedence rule blocked -- both are now moot since Extract nulls all of MPI's desc unconditionally.)"
    },
    {
      "path": "identity.type_family",
      "tier": "syntactic",
      "stage": "B",
      "rationale": "Resolved 2026-07-16 (supersedes the original semantic/stage-C classification below, kept for history): for NVSHMEM and OpenSHMEM, the type axis is a purely mechanical, source-derived signal -- NVSHMEM's NVSHMEMI_REPT_FOR_* macro invocations and OpenSHMEM's TYPE/TYPENAME tex tables both enumerate the exact concrete type list a family is generic over, with no judgment call involved in reading it off. (Original rationale, no longer current: 'Recognizing that the type axis collapses while the operation axis does not ... is a cross-entry judgment, even when the source uses a naming convention that hints at it.' The operation axis still never collapses -- that part of the original reasoning stands; only which stage populates the type axis changed.) See workflow/extract/nvshmem/adapter.py and workflow/extract/shmem/adapter.py."
    },
    {
      "path": "bindings.*",
      "tier": "syntactic",
      "stage": "B",
      "rationale": "Directly derivable from which language bindings the source declares and their exact declared signatures."
    },
    {
      "path": "execution.blocking",
      "tier": "semantic_heuristic",
      "stage": "C",